title,manufacturer,model,year,condition,functionality,price,currency,location,country,dimensions,weight,electrical,description,seller_name,seller_verified,listing_id,category,detail_url,image_url,last_updated
PaddelmischerZasadaML600,Zasada,ML600,,gebraucht,,19.000,EUR,"Niedźwiedź 250, 34-735 Niedźwiedź, Polska",1.229 km,,,,Zasada Schaufelmischer-Typ: ML600-Kapazität: 600 l-Mit Beschickungseinrichtung-Maximale Beladung: 200 kg-Maximale Drehzahl: 35 U/min-Rechts-/LinkslaufGo Dkbmsxr Nxqjpxetu-2 Mischwellen-Baujahr: 2012-Abmessungen mit Beschickung: 1950 x 2000 x 2650 mm-Abmessungen ohne Beschickung: 1950 x 1200 x 1500 mm-Maschine aus Edelstahl-Stromversorgung: 400V 50Hz-Zustand: gebraucht / sehr gut / generalüberholt / einsatzbereitDas Inserat wurde automatisiert übersetzt. Übersetzungsfehler sind möglich.,Hinweis:,No,20409965,Anschlagmaschinen,https://www.maschinensucher.de/zasada-ml600/i-20409965,https://cdn.machineseeker.com/img/frontend/main/logo/ms_logo_de.svg?v=1763643660,
ZuckerrührerRegoS 32,Rego,S 32,,gut (gebraucht),,600,EUR,"Lwowska 55, 35-505 Rzeszów, Polska",Polska,,,,"965 USED Rego Konditorei-Schläger.AUSSENMASSEN (in cm.):- L: 68,- H: 167,Gj Dkbsvck Ncempxotu- Breite: 64.Die Maschine steht zur Besichtigung in unserem Lager (36-068 Bachórz, Polen) bereit.Zahlbare Optionen verfügbar: Aufarbeitung / Transport / Installation / Inbetriebnahme.Der angegebene Preis ist netto.WIR SPRECHEN ENGLISCH, DEUTSCH, FRANZÖSISCH, RUSSISCH, UKRAINISCH.Das Inserat wurde automatisiert übersetzt. Übersetzungsfehler sind möglich.",Hinweis:,No,17900386,Anschlagmaschinen,https://www.maschinensucher.de/rego-s+32/i-17900386,https://cdn.machineseeker.com/img/frontend/main/logo/ms_logo_de.svg?v=1763643660,
Metall-DetektorGoring KerrDSP2,Goring Kerr,DSP2,,sehr gut (gebraucht),,1.250,EUR,"Stockwith Rd 4, DN10 4ES DN10 4ES, United Kingdom",United Kingdom,,,,"Goring Kerr MetalldetektorModell: DSP2Gte DkbmpegmtiasxeuRostfreier Rahmen, Bandabmessung 2400mm x 200mm, Durchlass 300mm x 100mm, pneumatischer Blasauswurf in den Ausscheidebehälter, 3PhDas Inserat wurde automatisiert übersetzt. Übersetzungsfehler sind möglich.",Hinweis:,No,5586144,Anschlagmaschinen,https://www.maschinensucher.de/goring+kerr-dsp2/i-5586144,https://cdn.machineseeker.com/img/frontend/main/logo/ms_logo_de.svg?v=1763643660,
Be- / Entladestation (Autoklavenkäfige)ENT Edelstahl- und Nahrungsmitteltechnik,ENT Edelstahl- und Nahrungsmitteltechnik,,2024,neu,voll funktionsfähig,Preisinfo,,"Oppenheimer Str. 8, 28307 Bremen, Deutschland",Deutschland,,,,"Funktionsweise:Der Autoklavenkorb wird vom Bedienpersonal in die Maschine eingeschoben und anschließend arretiert. Über ein Scherenhubsystem werden die Autoklavenkäfige schichtweise beladen, bzw. entladen. Die Modulbauweise ermöglicht die Kombination manueller, halb- und vollautomatischer Systeme. Bedienung erfolgt über Zweihandsteuerung.Belade- und Entladesysteme lassen sich mit folgenden Komponenten kombinieren:-Zulaufband und Drehtisch-Taktband Magnetplatte-ÜbergabeblechGo Dkbjt Ix T AempxetuAusstattungsvarianten:Alle Maschinen werden den jeweiligen Ansprüchen angepasst.Sprechen Sie uns gerne an.",Hinweis:,No,16601046,Anschlagmaschinen,https://www.maschinensucher.de/ent+edelstahl-+und+nahrungsmitteltechnik-m/i-16601046,https://cdn.machineseeker.com/img/frontend/main/logo/ms_logo_de.svg?v=1763643660,
Bandmischer Inox 1200,,,,sehr gut (gebraucht),,750,EUR,"Pogodna 79, 24-310 Karczmiska Pierwsze, Polska",Polska,,,,Die Maschine ist einsatzbereit. Bandmischer für Schüttgüter mit einem Fassungsvermögen von 1200 Litern.Gte Dkbmsyg EvvepxjuDas Inserat wurde automatisiert übersetzt. Übersetzungsfehler sind möglich.,Hinweis:,No,21160497,Anschlagmaschinen,https://www.maschinensucher.de/m-m/i-21160497,https://cdn.machineseeker.com/img/frontend/main/logo/ms_logo_de.svg?v=1763643660,
